{
  "schema_version": "1.0",
  "description": "设定编辑板块引导数据（机器规格）——2.1-2.5 各板块的询问模板与正反例。板块规则/双写同步/管理循环逻辑保留在 SKILL.md（规则性内容）。按需读取，不常驻 SKILL.md。",
  "sections": {
    "b1_status": { "title": "基本信息 — 读取现状", "prompt": "📌 当前基本信息（来源：项目信息.json）\n  • 书名：{book_name}\n  • 传播范围：{distribution}\n  • 内容分级：{content_rating}\n  • 篇幅长度：{length}\n  • 书籍种类：{genre}\n\n需要修改哪一项？输入项名 / \"全部\"逐项修改 / \"跳过\"维持现状" },
    "b1_distribution": { "title": "传播范围选项", "prompt": "📡 传播范围：\n  • 传播向 — 公开发布，面向广泛读者\n  • 个人向 — 自娱自乐，仅个人/小圈子阅读" },
    "b1_nsfw": { "title": "内容分级切换 NSFW 询问", "prompt": "🔞 检测到内容分级切换为 NSFW。推荐配置 NSFW 写作偏好：\n\n① 全书色色值域？（如 N3-N4）\n   N1—点到为止  N2—情色剧情并重  N3—情色为主\n   N4—纯情色驱动  N5—纯情色不间断\n\n② NSFW 输出词级别？\n   A. 输出词级别：限制级（优雅代称）→ 解限级（刺激升级，内含直白词汇）\n   （如选择了限制级，会追问角色语气：保守/中性/放荡；解限级同样追问（两档均内置三列语气分档））\n\n（均可跳过，后续 /nsfw-config 随时配置）" },
    "b1_length": { "title": "篇幅长度选项", "prompt": "📏 篇幅长度：\n  • 随笔 — ＜5万字\n  • 短篇 — ≤20万字\n  • 短篇（连载） — ≤35万字\n  • 中篇 — ≤60万字\n  • 长篇 — ＞60万字" },
    "b2_status": { "title": "简介 — 状态检查", "prompt": "📝 简介板块\n  • 对外简介：{当前内容 / （待填写）}\n  • 个人描述：{当前内容 / （待填写）}" },
    "b2_public": { "title": "编辑对外简介", "prompt": "📝 是否需要填写/修改「对外简介」？\n  （面向读者的宣传语，50-100字为宜。输入内容 / \"跳过\"）\n\n✏️ 请描述：" },
    "b2_public_confirm": { "title": "对外简介润色确认", "prompt": "润色后：\n{润色后文字}\n\n这样可以吗？（\"可以\"写入 / \"修改\"重新输入）" },
    "b2_personal": { "title": "编辑个人描述", "prompt": "📝 是否需要填写/修改「个人描述」？\n  （你自己对这本书的理解和定位，可随意写。输入内容 / \"跳过\"）" },
    "b3_status": { "title": "核心设定 — 状态展示", "prompt": "🔴 核心设定 — 必选板块（至少填写一项）\n\n当前状态：\n  • 人物：{当前内容 / （待填写）}\n  • 世界：{当前内容 / （待填写）}\n  • 故事走向：{当前内容 / （待填写）}" },
    "b3_character": { "title": "核心人物引导", "prompt": "👤 核心人物 — 请描述世界层面的势力/阵营格局与人物关系网（具体角色人设交给创建人物技能）。\n\n例如：\n  \"正道六派与魔教的对峙格局；\n   朝廷与江湖的势力划分；\n   几大家族间的联姻与恩怨。\"\n\n✏️ 请描述（输入 / \"跳过\"单项）：" },
    "b3_world": { "title": "世界概括引导", "prompt": "🌍 世界概括 — 请用一两句话概括这个世界的基本设定。\n\n例如：\n  \"一个魔法与科技并存的近未来都市，五大财阀掌控城市命脉，\n   地下的暗网是真正的权力中心。\"\n\n✏️ 请概括（输入 / \"跳过\"单项）：" },
    "b3_direction": { "title": "故事走向引导", "prompt": "📖 故事走向 — 请描述主线故事的基本方向和核心冲突。\n\n例如：\n  \"主角从山村少年成长为江湖盟主，对抗影子阁的过程中逐渐揭开父亲之死的真相，\n   最终发现最大的敌人是自己一直信任的师傅。\"\n\n✏️ 请描述（输入 / \"跳过\"单项）：" },
    "b3_empty": { "title": "核心设定空值约束", "prompt": "⚠️ 核心设定为必选板块，至少需要概括性填写一项。\n   建议至少填写「世界」和「故事走向」，这两个是最基础的创作锚点。\n   请至少补填一项：" },
    "b4_structure": { "title": "世界观结构约束", "prompt": "### 世界观 [必选]\n\n**{分类项名称}**：\n{内容——自由段落，长度不限}\n\n---\n\n**{分类项名称}**：\n{内容}" },
    "b4_menu": { "title": "世界观管理循环", "prompt": "🌌 世界观编辑 — 当前 {N} 个分类项：\n\n{列出已有分类名}\n\n请选择操作：\n  • 添加 — 新增一个世界观分类项\n  • 修改 — 修改已有分类的内容\n  • 删除 — 删除某个分类\n  • 重命名 — 修改分类名称\n  • 完成 — 世界观部分暂定，回到板块选择" },
    "b4_add": { "title": "添加新分类", "prompt": "🌌 新分类名称？（可选参考题材预设分类，如\"地理\"、\"魔法体系\"、\"政治格局\"、\"种族设定\"等）\n   → {用户输入分类名}\n\n✏️ 请描述「{分类名}」的内容：\n   → {用户输入内容}\n   → 润色 → 确认 → 写入" },
    "b4_edit": { "title": "修改已有分类", "prompt": "🌌 要修改哪个分类？\n  1. {分类名1}\n  2. {分类名2}\n  …\n\n✏️ 请重新输入「{分类名}」的内容（当前内容将保留为参考）：\n   → {用户输入} → 润色 → 确认 → 覆盖" },
    "b4_delete": { "title": "删除分类确认", "prompt": "⚠️ 确定要删除「{分类名}」吗？此操作不可撤销。\n   • 确认删除\n   • 取消" },
    "b5_menu": { "title": "设定铁律管理循环", "prompt": "🔒 设定铁律 — 可选板块\n\n当前 {N} 条铁律：\n{列出已有铁律}\n\n请选择操作：\n  • 添加 — 新增一条世界观铁律\n  • 修改 — 修改已有铁律\n  • 删除 — 删除某条铁律\n  • 完成 — 铁律部分暂定，回到板块选择" },
    "b5_add": { "title": "添加设定铁律", "prompt": "🔒 新铁律？（一句话描述不可破坏的世界规则，如\"筛选不可逆转\"\"念力≠灵熵\"）\n   → {用户输入}\n\n💡 铁律是世界观骨架——写正文和新增设定时都会对照检查，冲突即提示。" },
    "b5_edit": { "title": "修改设定铁律", "prompt": "🔒 要修改哪条铁律？\n  1. {铁律1}\n  2. {铁律2}\n\n✏️ 请重新输入该铁律：" },
    "b5_delete": { "title": "删除设定铁律确认", "prompt": "⚠️ 确定要删除该铁律吗？删除后新增设定不再受其约束。\n   • 确认删除\n   • 取消" },
    "b5_conflict": { "title": "自洽检查冲突提示", "prompt": "⚠️ 该设定与铁律「{铁律}」存在冲突：\n   {冲突说明}\n\n   • 仍要写入 — 忽略此冲突（谨慎）\n   • 修改表述 — 调整为符合铁律的说法" },
    "b6_menu": { "title": "术语表管理循环", "prompt": "📖 术语表 — 可选板块（写正文时随数据包分发强制生效）\n\n当前 {N} 个术语：\n{列出已有术语}\n\n请选择操作：\n  • 添加 — 新增一个术语条目\n  • 修改 — 修改已有术语\n  • 删除 — 删除某术语\n  • 完成 — 术语表部分暂定，回到板块选择" },
    "b6_add": { "title": "添加术语", "prompt": "📖 新术语名？（如\"灵熵\"\"筛选终局\"）\n   → {术语名}\n\n✏️ 该术语的准确定义：\n   → {定义}\n\n🚫 有哪些禁用混指词/表述？（写正文时遇此自动纠偏，可跳过）\n   → {禁用词，逗号分隔，如\"吞噬、销毁\"}\n\n📝 补充说明（区分要点/易错点，可跳过）：\n   → {说明}" }
  },
  "examples": {
    "public_intro": [
      { "wrong": "这是一个关于主角成长的故事，他经历了很多事情最后成功了", "right": "少年背负灭门之仇踏入江湖，却在追寻真相的路上发现——敌人可能不是人。一部融合悬疑与仙侠的复仇之旅。" },
      { "wrong": "好看，冲就完了", "right": "轻松日常向甜宠文。冷面王爷×话痨医女，先婚后爱，日常互怼。" }
    ]
  }
}
